Course-Code,Course-Name,Lecture-hours,Tutorial-hours,Practical-hours,J-Project-hours,Credits
BCSE103E,Computer Programming Java,1,0,4,0,3
BCSE202L,Data Structures and Algorithms,3,0,2,0,4
CSE1016,Deep Learning: Principles and Practices,2,0,2,0,3
CSE2012,Design and analysis of algorithms,3,0,2,0,4
CSE3061,Artificial Intelligence for Cyber Security,3,0,0,4,4
CSE3501,Information Security Analysis and Audit,2,0,2,4,4
CSE4056,Intelligent Multi Agent and Expert systems,2,0,0,4,3
BCSE205L,Computer Architecture and Organization,3,0,0,0,3
